isEdited,title,date,review,userName,rating,app_name,app_id,developerResponse
False,Gcash user since 2018,2020-06-07 04:57:17,"I've been using gcash for 2 years now, and yes it's not perfect, but it has helped me a lot in managing my finances, especially now that there's a pandemic and you just can't go out whenever you want to. It made transfers between different banks easier. I'm able to pay my bills at home. Connecting my bank account to gcash and cashing in and out happens real time. Although I've encountered some issues like unsuccessful transaction and yet money is deducted from my account, or errors in paying bills I'm usually paying every month, I still believe these are just minor lapses which Gcash will be able to address (in my case, money deducted was returned, and I'm able to pay the bill by retrying several times). Not to mention Gsave (partnered with CIMB) which has a 4.1% per annum interest rate, which is WAAAAY above what banks offer.

So as a summary, I still believe Gcash is a great app to use. Go ahead and download it!",Kyo V,5,gcash,520020791,
False,Read please!!,2021-01-12 09:46:26,"Those others who doesn’t like gcash don’t expect to much of gcash because not everything u want can give it. To those others who have an error maybe give a little more patience, think of it as the time is giving u a challenge like if u can give more patience or not, you just really need time and maybe try to solve what’s the problem first before you dramatically go crazy. Anyways other than that base on my experience, I just don’t get why people don’t realize that we are all hurting but nobody cares, at all maybe at least try to solve your problems with those people close to you and don’t make up things that’s not even true from the start the girl is hurting and not only for girls but for boys as well and again other than the things I just said right now I’m happy of using the gcash that’s all bye anyways sorry for telling my feelings I just can’t take it anymore",Monica cheekee,5,gcash,520020791,
False,Delayed Payment Reflection,2020-07-16 05:22:48,"GCash serves as a really convenient way to purchase and settle bill. My first ever transaction this June 2020 to settle my Globe postpaid account (same mother company) has been neglected countless times and remains unresolved up to now though. My line was actually cut for four (4) days due to this unreflected payment. 

I have resorted to the Globe hotline 211 which does not provide any AI option to address this. Globe store asked me to take this up with G-cash through their 2882 hotline. G-cash hotline and online were quite helpful to confirm that payment has already been reflected on the system of G-Cash, but my Globe One account does not state the same. Now G-Cash wants me to coordinate back with Globe. Both are pointing fingers at each other. Three weeks have passed and still no solution from either G-Cash nor Globe!

One thing I know is when my billing due date arrives again, neither of these two (2)  companies will have their services cut because of an “unapplied” and “unreflected” payment already made.",Jem Ang,2,gcash,520020791,
False,7 years and counting,2021-02-17 09:15:31,"Been using gcash for 7 years and I can say it did improved over time. One of my concern is the user interface. Too much is going on. And as time goes by, gcash has more buttons being added. Would prefer if it’s only cash in, cash out, send money, save money, pay bills, g forest and buy load. Would also appreciate if we can withdraw our gcredit since not all establishments accepts gcash payments. Plus my gcash mastercard always get declined when i pay using pos eventhough i have more than enough money on my wallet. I unlinked my mastercard already coz nakakahiya everytime nadedecline ang card kahit may laman naman.  It would be better if gcash produces another set of cards just for gcredit use only. So far gcash is a great app compared to other e-wallets i’ve tried.",Yanie97,5,gcash,520020791,
False,Worst Customer Service Ever!!!!!!!,2020-07-06 06:55:09,"My old account number was blocked and can’t receive any messages anymore. So, I immediately called the customer service on June 30, 2020, about the issue and asked me to create a new Gcash account because they will send there my balance on my previous account. They asked for all the details they needed through email and sent it to them immediately. After 2 days (July 2) I received an email from them that the amount was already sent on my new account they sent a reference number with date, I already told them that I didn’t receive either the money or the reference number. I immediately called the customer service and keep calling them, up until now (July 6) the same answer I am getting from them. What the Heck, Gcash!! All your agents don't know what to do with this issue!!!! 😡😡 And one of their agents has no manner with the customer. Are they really a customer service or just a representative with no etiquette and manner?",ADC@22222222444444,1,gcash,520020791,
False,Hard to use and not user friendly,2021-03-02 02:36:53,"I only use this app because it’s the only way I can make purchases online or through my phone. I tried linking my GCash account to my paypal, but after realizing that my last name in gcash and paypal are not the same because of a misspelling between the “n” and “ñ” in my name, I tried changing it and even verified my account multiple times JUST TO CHANGE THE N TO Ñ. Every single verification was declined. I also had problems in in-game purchases. The first two times I purchased in a game, they worked completely fine and I have a lot left over from the two purchases but then when I tried to make another one today, I always receive the “you have reached your overall transaction limit” notification. I had a lot of money in my account and it is impossible that I have reached the limit. I am also fully verified and saw that a few hundred pesos isn’t my limit so please fix this.",GCash wth?,2,gcash,520020791,
False,"Was good, but...",2020-07-13 11:01:25,"I use GCash to pay my bills. My bank (HSBC), is not one of the banks that has direct communication with GCash, but I was able to cash in via the Mastercard/Visa option. Now they removed it. Since HSBC online does not support GCash, I need to physically withdraw money, and cash in via over the counter. This is a shame because of the current pandemic, I want to stay away from people as much as possible. Now it’s two crowded areas I have to go to. Another thing, 7-11’s cash in is a confusing robbery! I did two transactions, because they only allowed up to 10k for a transaction. The 10k cost 60PHP but the 9.1k transaction was 180PHP! What?! 

One more, I linked it with my App Store. I bought an in game product, got deducted, but nothing was credited to my account. I contacted the ticket desk, but there has been no reply except for an automated thank you note. 

Convenience was the only thing you had going for you, and you’re messing it up just like all other Globe services.",jmg1303,1,gcash,520020791,
False,Customer care inconvenient to use,2020-06-07 09:31:21,"Gcash has been very helpful in many ways to me. Most transactions are smooth. However, in times of issues or concerns, it takes forever to resolve the issue and the customer support chat is annoying. First, you contact them and inform your concern, then when you get ahold of them, they will ask you to fill up more forms. There was this instance that i am contacting them for a 15 pesos load that i didn’t receive, and i had to answer 2 forms! 1 for the info and one for dispute form. I mean seriously??? It’s time wasting specially if you are just asking for the refund of a 15 pesos deduction. I would understand if it was a big amount, but for small bills, Customer support should be able to do it on their end without so much hassle. Unless Globe does not trust their own people. Then I suggest you get people you trust. I’m leaving my review to 1 star unless I see that the customer support and Gcash resolution is improved.",Jade041812,1,gcash,520020791,
False,Improvement Suggestions,2020-06-28 02:58:24,"1. When a biller is saved, the information is deleted either when a new user logs-in to the app (via switch user / change logged-in mobile #), OR during the next app update is released. The info should be saved per user profile so the information is still available anywhere (roaming) the user logs-in.
2. Biller account #s such as in a Meralco Ref# should have separators (i.e. dash) on the confirmation page for readability. This is burdensome and is prone to typo/human error when paying such bills with long account numbers.
3. The date is showing the Year 1970 on mailbox items on IOS v9 despite installing the updated version - this is not accurate info especially during an audit",regsville,4,gcash,520020791,
False,GCash Balance,2021-05-05 06:44:10,"A few days ago I was going to pay bills using my GCASH account with about a thousand peso balance. Unfortunately, I couldn’t access my account as my authentication expired. Due to poor internet connection, there was always delay in receiving my OTP. I logged in about 3 pm then the OTP arrived just before I was going to bed about 11:30 pm. The next day I tried again same thing my requests for OTP took many hours before I received them. Today I tried again after 3 tries I was able to go through to have a new MPIN. For verification, Globe asked 3 questions. What is the number of my cell phone linked to my account, email address and if what level I am verified. I supplied my number, email address and indicated I am fully verified. Finally, I was verified. I was able to log on to my account but I was surprised as it has only 20 pesos balance. How come? What happened to my thousand peso balance?",GTinio,1,gcash,520020791,
False,Problems I am experiencing with the app,2020-07-17 01:05:54,"Hi Gcash Developers,
This is a good app for cashless transactions but still has a lot to improve. Here are the problems I am experiencing 
1. When I link my BPI account here, it’s weird that it won’t take the password for my BPI app, I ended changing my password in BPI for 6 times. It always show that the password is wrong so the BPI app blocked my account and password needed to be changed.

2. Transaction History - I think it would be great if the transaction history shows the receipt generated after the transaction and by the way, sending the transaction history to my email is not working

3. In addition to the transactiob history, when I export/save the transaction receipt to my phone, it is cut off in the middle. I don’t know why but yes it is cut off right in the middle.

4. Some fields aren’t working - I am saving BIR as a biller, but when I tap on “preferred biller name” it is not working. Hence I cannot save this biller and I have to go through the usual process when I pay bills. 

I hope these bugs in the app can be addressed. It’s a financial app and highly utilized, money is being handled so it has to be really working efficiently. 
Thank you",CarloHofilena,2,gcash,520020791,
False,I didn’t agree to terms but my details were already submitted for verification,2020-07-16 13:19:30,"So I was trying to get verified in order to use the send money option. I’ve filled out the forms and then the next page asks if I agree to the Terms and Conditions and when I clicked the Terms to read it, it said “network unstable”, then I was back to my filled information and when I clicked next, the agreement asking part to the Terms is no longer there and my details were automatically submitted to Gcash verification. This is so off, I didn’t agree yet my details were already submitted!! When I checked the Terms and Conditions under Help, there is an error loading. I do not know if this would be sketchy but I hope you can fix this and I really hope that Gcash would handle my data well because I seriously didn’t agree to the Terms yet.",Blah blah game,1,gcash,520020791,
False,Please hear my concern,2020-08-07 00:15:29,"I really love gcash but what annoys me is their slow maintenance and lack of announcement whether a service is unavailable. Please, please, if you are doing some maintenance in the app or services, give us notification and state everything that is happening in that notification (i.e. your fixing a bug that is why load service is not available). It is a hassle for me to not know because    I started a loading business and kept losing funds because your service is always not in good shape. I want to know in advance that a service will not be available so that I can notify my customers that a service is not available. If ever you read this please consider my suggestion.",Rin_dt,3,gcash,520020791,
False,This selfish app doesn’t care about the customers,2021-03-04 01:06:10,"I understand there are fees being charged for bank transfers while it is basically free in other countries, and even though I also know that you are charging for fees way above what you get charged for by Instapay. Ok fine. I dealt with that.

What’s really annoying to me though is that you even have the guts to not shoulder the data for the customers. Using the app should be in free data mode IMO. It becomes very useless in situations where you have cash in your wallet but unable to use it because you suddenly ran out of data. If you really want to make this app a replacement for real money at least do that for your customers. I would not like to use a virtual wallet app that I suddenly cannot use. That’s too unreliable. I’d just rather use real money instead.",Exequis,1,gcash,520020791,
False,OVERCHARGING,2020-07-22 05:13:29,"When the news about their service charge of 2% broke out, Gcash denied it saying it’s not the case. Days after, may service charge na every time you cash in more than 8000 (which btw became their “monthly limit” contrary to their supposed 150k cash in limit). 

Two days ago, I cashed in a total of 10k because bills. I got deducted the 2% service charge (which is fine nalang). Then, two days later, I added another 400 because I need to pay someone. When I checked my notification, I was deducted with a service charge ulit? I was assuming that the service charge would only apply one time. I’ve been on the same scenario wherein na hit ko na 8k in a month and tried cashing in more but there was never a service charge for those. Very upset with how money hungry Gcash is these days.",inigan,1,gcash,520020791,
False,GCredit Blocked for No Reason!,2021-05-21 08:15:52,"I have been using this app for years to pay for my online transactions and also to send money to my siblings, purchase load and pay for my bills. I have also been using GCredit and have been paying my dues even before it’s due but a few days ago, I suddenly cannot use my GCredit. I have submitted the documents they (CIMB) have requested for and yet, TODAY, I received a text message coming from CIMB that my GCash account will be temporarily blocked without further explaining WHY. They then sent the same freaking link to submit the same freaking documents they have requested for and which I have already submitted to them, to undergo the same freaking VERIFICATION. GCash is so much better when it’s not yet affiliated with CIMB— a bank that makes everything complicated!!",kjera927,1,gcash,520020791,
False,Poor customer service,2020-07-24 13:50:59,"I transferred a sum of money to a bank account through GCash. Due to the volume of transactions  the recipient has in their bank account, they cannot identify my transaction. I requested the customer service to provide a supporting document that can be used by the recipient to trace the amount I transferred. Unfortunately, all I received is just an email confirmation that the amount was credited, nothing else. I keep on following this up but all I received is that they need more time to check on how they can help me. This is so frustrating because it’s already been 6 months. I’ll never use Gcash again for transactions involving large amount of money. They don’t know how to help when something like this happens.",Cris N. F.,1,gcash,520020791,
False,I hope you make an app for the apple watch,2021-01-14 02:56:10,Almost everything is great when I am using my gcash but one thing is missing. A gcash app for the apple watch for the people who doesn’t usually brings their phone and when in crwded areas I dont have to get my phone out just to pay something. It will be better if you will make an app for the apple watch to complete the experience of using gcash. I hope you make one soon or in the future. But everything is great it’s just that you need to make an app for the apple watch to complete the experience. Thank you,dv vfx,4,gcash,520020791,
False,Bring back load to gcash,2021-01-25 19:06:02,"I wish you could bring back the feature wherein you could convert your load to gcash money. The thing is, i asked my sister to give me 50 pesos load, and you know what happened? My sister accidentally inputs 500 pesos instead of 50 pesos? What am i to do with 500 when i only need 50 pesos and we have wifi at home. I rarely go out but when i do go out i need to have data, not a lot just enough internet data to connect to people I'm meeting up with. 😑😑😑 what am i supposed to do with the 450 ? It will all be wasted . And 450 could be enough money to buy snacks or a decent dine-out with friends. Its so inconvenient. Bring back that feature.",ikkkkkiiii,2,gcash,520020791,
False,GCASH Costumer Service is 100% DELAY,2020-11-18 05:10:54,"For a couple of days, I’ve been trying to get fully verified and unfortunately my ID wasn’t on the list since I only have my student ID. Every time I tried to use my student ID for fully verification, it will always says “unclear photo” what’s even more confusing is that the photo taken is crystal clear and i don’t understand why it won’t read. Luckily a friend of mine told me that gcash isn’t accepting student ID anymore and so I have to submit a ticket from their help center, fill out the information needed and guess what, it has been days after days and tickets after tickets but still i get no updates when will i get fully verified. I urgently needed the money but the gcash system isn’t helpful at all.",luchuff2017,1,gcash,520020791,
False,Need School ID immediately,2021-03-16 05:18:47,"Hello! I’m a student and I still haven’t reached the legal age which is 18 years old. Meaning that I still don’t have the government id, passport, and etc. I only have school id. Some of the money-making app including Kumu and etc. helped me a lot and the gifts can be converted to cash. And for me to accomplish this, I have to have a verified Gcash account. Same with the other money-making applications and websites that I have. But I can’t do this because it doesn’t include the School Id for total verification. Please include the School Id because we students are finding money despite the pandemic.

It means the world to me to bring back the School Id for verification. Thank you.",bearstethic,2,gcash,520020791,
False,Verification failing,2020-07-10 07:27:55,All was good until when i try to verify my account its been 2 days already of verifying my account and it still says that service temporarily unavailable and at first my email verification was also broken even tho it was the correct pin that was sent to me it still say oops and all but i verified my gmail already but my account cannot be verified and its such a hassle to wait please tell me whats wrong there’s no help in the internet and some are getting verified so why can’t i?,joshuacaronan,5,gcash,520020791,
False,I wish they support Apple Pay,2020-06-03 11:33:39,"I definitely love this app, but I don’t want to use its “scan feature to pay” feature all the time cause sometimes it’s a hassle, I wish the app would have a feature like the “Apple Pay” I really wish they would adapt that feature not only will it be quick and easy it would be hassle free as well! So I really wish they would team up with Apple Pay, so that it would make life easier when paying at mall or something, cheers guys.. :)",Kong360,5,gcash,520020791,
False,"My mistake, my experience",2021-04-24 09:52:24,"If you are giving services that involves money, then do better on your security. Your platform is not even safe. It is so easy to transfer a fund that you will only need a phone number. You must atleast put an address of the receipt or the sender. And a photo on your receipt since your  account must be verified. You don’t cover swindling that’s why a lot of people are using this as an advantage on scam or fishing because you can’t tract them and the platform won’t provide any information that could help you retrive the fund. They can just received money immediately so please at least put address ( not necessarily specific) or some information. That would be all thank you.",justsaying20,1,gcash,520020791,
False,Smooth transactions,2020-10-20 05:07:53,"GCash has definitely been a necessity to me and my family since March. When we order produce, we get it only from those who have access to cashless transactions. No problems so far — just that sometimes, email confirmation of transactions is a bit delayed. There is also one small problem with the GlobeOne integration — the due date being shown is the date today instead of the actual due date from GlobeOne.",_sandyfelipe,5,gcash,520020791,
False,Does not allow snooze updates even in the middle of transactions,2021-02-25 03:29:02,"I appreciate the increasing featured of this app but what I’ve always found unnecessarily inconvenient is that it doesn’t allow snoozing of app updates - it will force you to update or else you can’t use it. Even if I was in the middle of payment transaction as linked from another app - as a result, the payment transaction did not push through but the voucher I had with the app was marked redeemed so di ko na magamit kahit di kumagat nung una dahil sa force update ni Gcash! Panira ng transaction! Di ko na nga lang gamitin for payment. What’s wrong with allowing snooze for updates and imposing snooze limits???",J1mm1ch,3,gcash,520020791,
False,Buggy app,2020-12-23 02:25:47,"Some missing fields on bill payments like MoneyGram, also buying load gives you an error but takes your money and doesn't give it back, and GCash Support sends pre-encoded messages and never seems to understand the situation most of the time. I am aware that there will be delays in replying because of the pandemic, but I don't think that can put them behind reading every single word in client replies.

If GCash had an Add to Apple Wallet button, I would use that instead of the app because of Touch ID and how it shows on your lock screen.",R. Siyluy,3,gcash,520020791,
False,Annoying,2020-06-17 06:19:39,I don't like it how an update is a must. everything works fine for me cause I rarely use the app. and that rare times are only when I use the app to transfer money to my bank account. Though it’s really annoying when an update is avaible and you make the user update the app first or else we can't use it. what if there’s an emergency and we need to use the app but can’t update at the moment?? or when the user is using mobile data and doesn't want to use data to update? seriously you gotta work on that. not everyone can automatically update the app when there’s an update available. don’t make it a must.,daneeey,2,gcash,520020791,
False,Poor poor poor,2020-08-18 03:01:20,In the app it says limit for basic users is 5k i spent less than 5k then it says since im a basic user i used up my overall limit... there are no warning or anything and they will accept cash in thats above your limit now i cant use my remaining money cause i dont have the recommended ids but i do have other valid ids but this company wont accept anything else other than whats recommended but what pisses me off is accecpting money thats more than the so called overall limit for basic users and then there are no warning abt thia overall limit and their guide where it shows the difference between basic and verified is misleading its a load of crap dont download,808210,1,gcash,520020791,
False,Irresponsible and Unprofessional,2020-09-22 02:21:08,"Dear people 
*READ THIS*
Let’s start with a problem I have...
It is been a 4 months that I can not link my Paypal to my Gcash because of credentials (credentials means first name middle name last name must be matched)
So there is a (N/A) in my middle name on gcash which Paypal does not accept . I talked with many people, many agents, many teams.... and they are way too UNPROFESSIONAL! 
How difficult is it to delete a middle name?
They are just trolling me by asking many many many questions and transferring me to the next team!
Yes! To the next team and the cycle starts again! 

They asked many personal and high security questions and requirements such as signature and selfie and every single ID you have.
And then after that, NOTHING!
Although I should mention to all you people that Gcash is Irresponsible for any of your problems. Understand?! If you lost your money inside. That’s gone.... if you can not transfer... it’s gone.... and if you are thinking to withdraw from Gcash card. It has 50PHP interest.

Delete the app and use your bank only.",Roadmard,1,gcash,520020791,
