isEdited,title,date,review,userName,rating,app_name,app_id,developerResponse
False,option,2021-04-10 10:49:27,please give us option if we want to update the existing version because i dont have any problem so far with the old version,Teamenergy pagc,5,gcash,520020791,
False,Keyboard not working on IOS app,2021-02-26 14:29:12,Seems there’s a bug while using the app on IOS. I’m using iphone 11pro. Keyboard does not appear when paying bills. Tried to update and reinstall the app. Still not working. Pls fix the issue.,iamayriinh,1,gcash,520020791,
False,App doesn’t work,2021-02-18 06:13:19,"Its not opening till now from the time I downloaded it, I already uninstalled and reinstalled still not working 👎🏻👎🏻👎🏻👎🏻👎🏻👎🏻👎🏻👎🏻👎🏻 especially that contacting globe through msg all will always route you to the app",RM Russel,1,gcash,520020791,
False,Taking too long to open,2020-12-26 13:17:12,It's taking me 1-2mins to open my gcash.. all the time. Pls fix this.,ValyneGarsenald,4,gcash,520020791,
False,Fix the loading issue,2020-12-14 09:54:38,It takes almost 5 minutes just to open the application even if it is updated,MinSugaa❣️,1,gcash,520020791,
False,STUDENT's ID,2020-12-10 02:06:27,Please let students get verified to their gcash account. I'm a student and I want to get verified on gcash because it's where my mom sending my allowance but I can't cash out because I'm not fully verified. Gcash has been a great help for us. Please do something. Thank you,nadine111223,1,gcash,520020791,
False,unreasonable,2020-09-02 03:39:52,I’m having a hard time verifying my account. it says it will just take 5mins but I’ve been capturing my passport for the past hour. Please fix this. Thank you,Lord Magenta,2,gcash,520020791,
False,Dont turn off other nerworks promo load,2020-07-30 01:36:18,When will smart and globe promo or load will be available again ??? I’ve been waiting since yesterday make it happen asap.,gcash loader,1,gcash,520020791,
False,Until now my account can’t be verified,2020-07-11 09:58:03,"It says verification will be done in 5 minutes, it’s been almost a day and my account still isn’t verified",Dhadrem,2,gcash,520020791,
False,Cant sign in even if mu internet is fast,2020-06-26 09:19:10,I dont know why that my gcash cannot log in but other phones can. I tried so mang time to unibstall and install it but still didnt work,kayelayan,2,gcash,520020791,
False,Limits,2021-05-10 08:03:08,"Hi, please consider po to make a section na malaman namin kung aabot na kami sa limit namin, and also how can i have additional limit for incoming and out going transactions. Thanks.",carryon carryon,4,gcash,520020791,
False,exceeded limit,2021-05-19 10:38:07,ran out of limit this app is now useless thank you and i cant transfer my money to a different app cuz i have to get fully verified which i tried doing and i keep on getting turned down F this app,remove the power ups,1,gcash,520020791,
False,Needs a lot of improvement,2021-03-24 11:05:14,Load service is not working most of the time.,Ritzel O,2,gcash,520020791,
False,Bank transfer delay,2021-03-24 09:35:27,There is always have a delay 3-5 days when transfering money to gcash to another bank but in some my other friend’s they are not experiencing this. Hope you fix this very soon,hahwhavvabq,1,gcash,520020791,
False,Worst customer service,2021-01-31 02:22:08,"My account was charged without the transaction successfully going thru, and I’m asking for a refund. It’s been a month now but I haven’t heard anything from them yet. Worst customer service.",Kbarbin,1,gcash,520020791,
False,Unreliable Customer Support,2020-10-15 04:52:33,All you can talk to are customer supports who respond like bots. 1 week passed and I don’t have a findings if the transaction got to them or not. Just that inquiry and it took more than 1 week and no response whatsoever.,Den de lion,1,gcash,520020791,
False,Logins,2020-07-29 16:36:09,always having issue with MPIN logins try to reset it a couple of times now but it wont log me in i have a good internet connection but im still having issues,Clone Nate,2,gcash,520020791,
False,Updates,2020-06-06 14:44:28,"Once there is a new version, you don’t have a choice but to update 😔",ahtr25,3,gcash,520020791,
False,Error on mpin,2021-04-24 05:06:37,This app suddenly keep on giving me submit a ticket when i log in and i tired redrrshing it still wont open i have money in my account and i use it as my main transaction,filthyfrankkku,1,gcash,520020791,
False,Unable to type,2021-03-21 23:29:06,I'm using Iphone 7plus. What's the issue? I can't even type anything to put any details when paying bills. What I can do here is just to buy load only. Please fix the issue.,Potzkiepots,1,gcash,520020791,
False,Not Working on my iPhone 12,2021-02-15 04:49:30,I am fully verified on my iPhone 12. I cannot edit merchant information. The app doesn't allow me to input anything on the merchant fields. Tried the app on an iPhone 11 and iPhone SE2 without issues. Please help.,AL.Dee,1,gcash,520020791,
False,ERROR,2021-01-01 06:20:56,"I’ve been having trouble with gcash the past few days, it ate up my load and the money that was supposed to be transferred to Grabpay, every penny is precious to me and I lost 334 pesos already if Gcash keeps this up i’ll be using another app",itomizuki32,1,gcash,520020791,
False,Not for real-time transactions,2020-12-21 04:06:52,"I used this to pay at S&R. It’s taking a long time to acknowledge the transaction (thru text) but my account has already been debited. I was holding the line at SNR, btw, so the cashier has to cancel my transactions.",Riz dlc,1,gcash,520020791,
False,NBI Clearance for validity,2020-10-24 04:54:33,I hope that you add a NBI clearance in this app so that I can manage my Gcash Easily. Thank you,Rorobells,5,gcash,520020791,
False,Account problem alert!!,2020-09-21 16:16:00,Can’t open my account after I updated to ios 14 the hell is wrong with this app! Fix this problem!!! This is very inconvenient to your customers. So unprofessional and incompetent,LouisV981,1,gcash,520020791,
False,Weak on security,2020-08-13 20:10:36,"Gcash is weak in its security.
They allowed an online purchase without sending the validation from the user.
Gcash automatically pay the bill due only that it was once used in the online purchase.",zz.$,1,gcash,520020791,
False,Can't get verified,2020-08-03 19:50:20,I can't get verified! Because there is no other id options! It's to take a picture of my passport because it always it's blurred even it's not.,Oh sehun_12,2,gcash,520020791,
False,Thinking of uninstalling the app,2020-07-27 01:10:34,It’s been almost a month and the Cash In system via linked card is still not available. It isn’t convenient anymore.,jbzvrn,1,gcash,520020791,
False,Application issue,2020-07-07 13:17:17,I cant access my application since last week.. i cant log in :( tried with another phone it worked but on my personal phone its not working,Jannin.17,1,gcash,520020791,
False,Crashes when trying to link paypal account.,2020-06-22 05:52:29,Crashes when trying to link paypal account.,treblapej,2,gcash,520020791,
False,I can’t load sometimes,2021-01-27 11:22:46,Well most of the time When we need it the most.,Chelle Iya,3,gcash,520020791,
False,Upgrade please,2021-05-06 14:16:22,"At first it is very convenient but as users grew in number,  it started to go down hill. Server is always down.  You can’t even verify your own account. It  is pretty annoying",Divina Calastravo,1,gcash,520020791,
False,Unable to input amount on Pay Bills,2021-04-21 16:32:48,I am unable to input amount on Pay Bills. My keypad is not showing up. Cannot proceed to payment.,Haikela.Paleki,2,gcash,520020791,
False,Fix Gcash Forest,2021-02-18 04:47:09,Please enable an unfriending option especially for those who love to steal your hard earned energy points. Totally senseless to let other people take what is yours. Please fix this.,Hansenfran,2,gcash,520020791,
False,Barrow load fail,2020-10-24 11:38:03,I can’t barrow load and my rebates where gone. I hope you fixed it. Thanks,thnxnln,3,gcash,520020791,
False,cant use gcash on wifi,2020-11-25 06:54:42,Keeps on asking my number but cannot log in and error message always pops in while using wifi. Poor service!,ReynoldRafa,1,gcash,520020791,
False,Can’t create account,2020-10-26 01:34:52,Keeps saying enter my last name even if I’ve already entered it. Tried many times doesn’t work even went to chrome website to register same result,ggwdwvwr,1,gcash,520020791,
False,Useful!,2020-09-15 09:53:36,"Using this app daily., bank transfers, load, bills., very usuful!",Elizarjacaranda,5,gcash,520020791,
False,i can’t verify,2020-07-31 10:13:28,"the problem is i am using IOS/iphone6 and the options of capturing the type of ID’s is limited, what’s the use of my professional identification card in this app if i can’t use my VALID ID 🙄 really annoying 😑",ivanaohnana,1,gcash,520020791,
False,Poor Quality,2020-07-26 02:28:18,The features are great but the quality and implementation is garbage. GCash is more inconvenient than convenient. Services and features are not reliable. Guaranteed problems with your money.,Engr. Stoic,1,gcash,520020791,
False,verification problem,2020-07-16 04:17:11,"i can’t pay my school tuition because my student ID didn’t accept for verification, they should make another improvement for this app so it may works reliable in this pandemic situation",navirabs21,1,gcash,520020791,
False,The app is broken,2020-06-02 02:14:19,Please fix these bugs that i have no option choosing a School ID and also verifying my email address part is also broken. Please fix this issue.,Blaster Silonga,1,gcash,520020791,
False,Do not reset the dashboard,2021-05-29 22:31:59,"Every update I had to re-arrange my dashboard. I don’t know what you need to do but please stop resetting the dashboard, it’s tiring to rearrange it.",pima813,3,gcash,520020791,
False,Navigation,2021-01-26 05:02:46,Easy to use,Gunknl,4,gcash,520020791,
False,14.5 iOs,2021-05-12 08:58:54,"Pay bills not working on iOs 14.5. Please fix.

[UPDATE]
It's now workiiiiiiingggggg!",mimizch,5,gcash,520020791,
False,Cant log in,2021-05-06 16:39:35,I recently got a new phone and somehow cant log in it says error this has been going on for months and its really bad because i still have money on the app,znnsaknsjwjw,1,gcash,520020791,
False,Can’t Edit the Biller’s Info,2021-01-14 06:20:37,"Been trying to edit my saved biller. However, the keyboard won’t appear after tapping the edit section.",crazy joners,2,gcash,520020791,
False,Gcash,2020-12-11 03:11:55,Most helpful app for my bills payment!,YoursMissR,5,gcash,520020791,
False,Unsatisfied,2020-12-27 01:55:11,"I hope you will not hide this comment, I’ve been waiting for a month for the ticket the Ive filed regarding my Gcash account connected to my number that is not letting me in. I dont know why they made this app. It’s worthless!",angryyyyuy,1,gcash,520020791,
False,Fancy GUI but antiquated basic functions,2020-12-17 03:49:43,"You put the sparkles and glitters on whatever but the bloody basic features are faulty, lagging, or stalls. Usually down than up. The pay bills features are grayed out. What a waste of space",Pia Bulsao,1,gcash,520020791,
False,"No matter how hard i try, i can’t get verified with my passport",2020-11-12 13:22:22,I’ve been trying non-stop for weeks now. What the hell is wrong with this app. I’m trying to pay bills and send cash to my family abroad,Pwinez,1,gcash,520020791,
False,The Most Inconvinient App,2020-10-29 12:25:47,"It will disappoint you when you needed it the most. You won’t receive the load, very slow support, the support functionality of the app is not working properly!",Jean_writer_00xx,1,gcash,520020791,
False,No school id option,2020-09-27 01:39:24,"It’s disappointing 
Why there’s no option like school id? How about the students who need to send money? I’ve try submitting a ticket twice but there’s nothing happen. I’m disappointed",jssijssi13ssi,1,gcash,520020791,
False,Magnanakaw,2020-09-12 00:58:58,"It is reeeally nice at first. So you will used it. But when you started having transaction errors, you can't contact them already, and you're missing money?it will never get back to you. Tsk. Magnanakaw.",𝐯𝐞𝐭,1,gcash,520020791,
False,Verification Process Not Working Since Months,2020-08-15 01:21:55,There is a system error during the verification process. Noted on social media feeds that many are facing this issue. Apparently Gcash either does not want to resolve this or does not care,Kershaw.Rustomji,1,gcash,520020791,
False,Where did my money go?,2020-08-07 07:16:46,"I went to Meralco to pay for a HUGE electric bill. 
They said all my Gcash transactions did not reflect in their system.

I tested it by paying for another bill through GCash and refreshing Meralco website over and over. 
It doesn’t reflect. 
Meaning my money is being taken.

I asked people that paid using Paymaya and theirs reflected immediately.

Mine has been MONTHS. 
My bills are high because my money was taken.",rossstheboss,1,gcash,520020791,
False,Thank you very much,2020-06-29 06:02:43,I can Finally verify my account thank you very much,Fortune48,4,gcash,520020791,
False,Unable to type!,2020-11-27 00:30:29,"The app is not allowing me to type anything. Mag babayad ako ng mga bills pero di magawa dahil di ako makapag type ng details like account number and amount. Please fix the bug asap. 

Thanks.",rikitita,3,gcash,520020791,
False,K,2021-05-09 04:50:25,I uninstall my gcash acc and then i try to login again system says something went wrong and unable to process the request i already tried how many times it's still unavailable. Lol,assdffgggjhl,1,gcash,520020791,
False,Can’t verify account,2021-04-10 15:38:40,"I need to send money for my fees but I can’t because my account can’t be verified. Gcash no longer accepts student’s ID, and I don’t have any card available yet. I hope you would consider this.",strawberry banana milk,1,gcash,520020791,
False,ID for verification,2021-04-03 06:32:53,It is Difficult to have an approved photo of ID. No matter what i do all the photos taken are unclear even though the image taken is clear.,Lica Nylan,2,gcash,520020791,
False,No change/removal of pic. Option,2021-03-22 09:31:09,Im too upset bc theres no way to change or remove my picture on this app..i hope you deal with issue this on your next update.,spartanzerone,1,gcash,520020791,
False,Disappointed,2021-03-08 04:03:24,I lost my acc with money in it because g cash said the my num is invalid even though my pin was correct. Why g cash? Why?. So disappointed all my money is gone now because of you g cash i cant access my acc anymore.,_manu_123,1,gcash,520020791,
False,Bug - Account Verification,2020-12-02 03:24:17,"My account was fully verified before. And went back to basic. Now trying to process verification, system glitch.
Cannot get fully verified. System crash.",EbortZx,1,gcash,520020791,
False,VERIFY ACCOUNT,2020-11-12 05:03:00,it keeps on saying the picture of my id blurred/unreadable. i have been repeating it for how many times yet still not accepting,micxzs,3,gcash,520020791,
False,I already verified my account,2020-11-26 11:18:31,"I already verified my account and letting me verify again. Moreover, when I try to verify it, it won't push through.",toothwires,2,gcash,520020791,
False,First time,2020-11-18 15:47:40,I don't have any I.d's but I have a card na I have one nga pala but it's barrangay I.d pwede nba un,Jhoanna nichole,5,gcash,520020791,
False,Scammer and Poor Customer Service,2020-11-18 00:55:04,Amount deducted form my account for buying load is more than the stated amount in the receipt. Poor customer service for repetitive requirements yet no progress on the ticket.,Ansherina Pink,1,gcash,520020791,
False,STUDENT ID,2020-06-23 11:16:40,Can you return the older version of Gcash? I can’t get fully verified since you removed the STUDENT’S ID. That’s the only ID I can use to be verified. Please help me out. Thanks!,Eleven_20,3,gcash,520020791,
False,Inability to verify,2020-11-03 10:09:26,"Until now, this app still keeps on saying it has an unknown error when it comes to verifying an account. It’s been months and still no solution. Very poor app",A disgruntled critic,1,gcash,520020791,
False,Sorry,2020-09-30 00:48:20,"It's very unconvenient because you put ""inconvenience fees"" and also they are deducting some money whenever the payment is for business purposes.",mayawatan,2,gcash,520020791,
False,cant deposit,2020-07-29 05:40:35,I can't deposit on my save money account + sometimes the buy load feature is crashing. You need to work these out.,margauxxxxx212121,1,gcash,520020791,
False,Great app. But I cant proceed invest on iphone 5se due to responsiveness,2020-07-21 06:30:41,Gcash invest cant proceed because the checkbox is placed beyond the screen,feminx,5,gcash,520020791,
False,Loading screen,2021-04-28 12:21:04,Minsan ang tagal mag load ng loading screen. Almost 1min minsan. Which is a deal breaker specially when you’re on a hurry,van_dumb,3,gcash,520020791,
False,PLEASE FIX GCASH APP!!,2021-01-23 07:16:03,I cannot open my gcash app in any device. Please fix it! It says that check my internet connection but my internet is good and stable.,Missyghel,3,gcash,520020791,
False,Inconvenient,2021-04-11 09:14:59,"With the updated version of the app, most of the billers are now unavailable for payment thru gcash. Its been days!!!! When will this be okay?????",kizp03,2,gcash,520020791,
False,Fix it please,2020-12-11 11:50:17,"Please... fix the app... it keeps on redirecting me to the app store for an update..
My app is up to date but still does it...",kang kungan,3,gcash,520020791,
False,BUGGY,2020-12-03 13:52:25,"The app is very buggy. More often than not, I experience delays, buffers, errors, even malfunctions throughout usage. It needs a thorough make over.",Dëvïant,2,gcash,520020791,
False,Transfer funds to coins,2020-06-09 13:22:52,"For the ist time ever, you surprise me ... nag transfer ako ng 300 amount to a coins user mag deduct sa funds ko at walang dumating na confirmation from gcash wala din na receive sa pinadalhan ko and worst di man Lang bumalik ang 300 ko pinag hirapan ko po yun puhonan ko yun sa crisis na covid na ito. Pero ninakaw niyo Lang.",jhessahl,3,gcash,520020791,
False,Codes,2020-09-07 18:28:58,I am trying to change my gcash number but i don't receive any codes. I've tried doing it countless times already. I even uninstalled then installed the app. Please do something about it.,asdfggjkllkenziendkwm,1,gcash,520020791,
False,Gscore going down,2020-09-02 18:28:19,"My gscore goes down as i use gcash more, which is strange because it’s the complete opposite of what it should do. Ive also seen others complain the same thing. They arent just doing anything at all.",mmbvfgubvdsrexhgg32,1,gcash,520020791,
False,Can’t open gcash please fix it,2020-08-27 06:59:26,"I have downloaded the app but when I tried to open the app it won’t work. I’ve tried it again and again, still it won’t open.",lioness098,1,gcash,520020791,
False,I cannot verify my account to upgrade,2020-07-19 12:23:44,"Sometimes the identity verification service is not available, then later on, the app just crashes when I try to verify my identity. I can’t use the app.",jerbersoftfx,1,gcash,520020791,
False,SUPER ANNOYING,2020-06-12 02:16:31,Its so easy to cash in but when it's time to cash out gcash is always offline!!! How can i even get my money when it wont let me cash out! Please fix your service! I actually need to pay using real cash!,imnotashley,1,gcash,520020791,
False,Loading,2021-02-06 17:02:43,App tooks so long to load when you open it.  Please fix it. Thanks,apejjulythree,3,gcash,520020791,
False,Bad,2021-05-13 07:58:42,"They told u to re take a selfie and verification again, and then the app crash after u filled all the information and trying to the next step, the app will crash,",pemdi,1,gcash,520020791,
False,All around e-wallet,2021-05-02 01:38:29,"Napakconvenient nitong app na to, savings, investment, credit line and e-wallet. 

Super helpful specially this pandemic",Capt. Yael,5,gcash,520020791,
False,Services always unavailable,2021-03-09 02:51:43,The loading and payment services are always unavailable. I tried to pay via GCash but it not working. It is very inconvenient.,Disappointed Wen,1,gcash,520020791,
False,Cash in,2021-02-08 06:57:17,Tried to cash in via Metrobank to pay my bills but I did not receive the money in the app and it deducted from my bank. This happened to me twice already,snoöze,1,gcash,520020791,
False,Frequent updates,2020-10-29 11:38:14,I always need to update it every time I open the app.,lielacalooy,3,gcash,520020791,
False,Garbage,2021-02-01 11:25:23,"This apps is garbage! The support group are so slow.. You can not even use  for paying bills, im using iphone11 pro max they can not fix the problems.",notworking at all,2,gcash,520020791,
False,App is slow,2020-12-21 13:39:56,"Opening the app is slow, you’d always opt to use mobile data than wifi.",bloodblockade,2,gcash,520020791,
False,Worse App,2020-12-19 11:44:28,"If you lost your phone or Sim, they will just give you ticket and will not solve your problem, even if you have balance in your account.",drinrem,1,gcash,520020791,
False,Verification,2020-11-11 00:05:33,You need valid id to send money leaving us students not being able to send money through gcash and there is no student id option in the verification,quertyszbsa,1,gcash,520020791,
False,Add Student ID for Verification,2020-10-18 01:25:02,I wish they could add student id for verification process. I don’t have any of the recommended IDs.,stlljr rrncstr,4,gcash,520020791,
False,Worst app!,2020-10-02 05:46:02,Worst app ever! Dont even try this! They are taking away your load balance and even hard to update. All the id has been given still hard to reinstall.,watcher pinoy,1,gcash,520020791,
False,Valid ID,2020-09-26 05:12:43,"Can you at least have the government issued ID from the PRC, so that we (young professionals) could get verified. We were at the starting point and could at the very least have one or two valid IDs. Thank you.",MISS UNIVERSE 2020,1,gcash,520020791,
False,Gcash,2020-08-22 03:34:29,I keep on sending you an email that I can't access my gcash app and keeps on sending me a notif that I need to send a ticket. I already send a ticket 3 times but you are doing nothing. I can't use the money on my gcash app.,nbtmg,1,gcash,520020791,
False,Always have a problem,2021-05-26 06:49:00,"Always have a problem or issue in transferring my money from paypal to gcash. 

Still you guys don't have customer service or live chat",helmooot,1,gcash,520020791,
False,Query,2020-08-20 14:46:56,why do i always have to update my gcash? i updated this app like 3 times in a month now 😑,smowlcactus,3,gcash,520020791,
False,Hard to log in,2021-05-15 02:57:41,It’s hard to log in. You have to restart several times until it accepts your MPIN.,prinsipeX,2,gcash,520020791,
False,Customer Service is worst!,2021-04-25 04:12:16,It’s very hard to get help when you have issues. It’s money that is involved here. Hopefully you can improve your customer service support!,CAidenDave,1,gcash,520020791,
False,Gcash payment not working on iPhone,2021-04-17 14:47:38,Keypad is not showing for iPhone and I can not enter the amount nor pay a bill using my iOS device. Please fix it. It’s very inconvenient.,gie.bee,1,gcash,520020791,
False,Payment Feature is No Longer Working to iphone,2021-02-25 06:04:31,"i can use to transfer money, but when im using for payments, data info are unabled",MsDizon,1,gcash,520020791,
False,Bad customer support.,2021-02-16 01:45:38,"I’ve submitted a ticket for customer support and they didn’t even acknowledged the attached file that I’ve sent it with, they immediately closed the ticket without any hesitation.",W1ngs1199,1,gcash,520020791,
False,Credit card cash in,2021-02-04 14:57:46,I like it before when you can cash in using credit card can you please bring it back?,mutsijenks,1,gcash,520020791,
False,OTP Problems,2021-01-21 04:05:10,"Been using GCASH for a while now. I cannot login because when I enter the mobile number, it will prompt for the OTP which doesn’t arrive or super late you can no longer use it.",Jikjake,1,gcash,520020791,
False,Asks for update almost everytime I use the app,2020-12-16 02:02:04,"Whenever I need the gcash, be it for emergency or not, its annoying how this app frequently asks for update. You cant use it when u need it the most.",justine8822,1,gcash,520020791,
False,Update reward scam,2020-12-05 04:29:10,Gcash removed the cash back and replaced it with a load to win which is useless because once you fill out the details you can’t press submit,wesleybanzon,1,gcash,520020791,
False,Crashing,2020-11-16 11:49:21,the app always crash when i try to full verify my account what is up with that ?,Apple genius wannabe,2,gcash,520020791,
False,Changes...,2020-09-28 13:37:12,It’s kind of sad that there’ll be fees for bank transfer starting October 1. :(,harriette joshua,4,gcash,520020791,
False,Great Concept Bad App,2020-08-30 04:38:52,"I love the purpose of GCash. The ease of paying bills and transferring money, but on a monthly basis I need to trouble shoot this app particularly for cash-in. Which makes this unreliable and it is easy to get in touch with customer service.",ILV usrr,1,gcash,520020791,
False,Verification,2020-06-02 07:57:52,my downloaded app does not have the other ID option for verification,Hra yewpe,3,gcash,520020791,
False,Love it!,2020-06-09 14:11:33,This app is the best! Makes your life very convenient!,Moonchild_2774,5,gcash,520020791,
