isEdited,title,date,review,userName,rating,app_name,app_id,developerResponse
False,Not safe at alll,2021-03-08 07:53:15,"A lot of fraud working here in Gcash, never ever use this app again",Chuchuvachuchu,1,gcash,520020791,
False,i hate hate this,2020-08-20 00:52:03,"i’m already fully verified. then i was suddenly downgraded to basic user. everytime i try to verify again, the app would crash.",Ciynmadi,1,gcash,520020791,
False,TIN ID issue,2020-10-27 04:47:47,I hope that they will allow TIN ID on verifying gcash its pretty devastating.,lllollllijfnthae,2,gcash,520020791,
False,A HASSLE JUST TO REDEEM GPLAY GIFT CARD,2021-03-08 00:51:53,GIving vouchers that can’t be used on pwn country. Have to install VPN they provided just to redeem it.,Capsize23,1,gcash,520020791,
False,Updating once in a while,2021-02-20 10:26:45,Hopefully wag mag update lagi kasi disturbing pag data lang ang gamit. Saktohan pa pag walang load saka mag uupdate. Tapos mandatorily pa kasi cant open without data. 😭,Pentelzen,1,gcash,520020791,
False,Can’t open,2021-01-02 05:28:53,I can’t seem to open my GCash account 🙃🙃🙃,Caity Oh,1,gcash,520020791,
False,2% service fee,2020-09-30 02:14:51,Y need to deduct a 2% fee since it didn’t reach 8k yet?,wjdjyroebd,1,gcash,520020791,
False,Worst of the worst,2020-09-02 11:05:20,Gcash has it all. Worst sevice always on maintenance and worst customer service.,mlcrap,1,gcash,520020791,
False,student id please,2020-12-25 03:08:27,please make student id valid again for verification,alxsaceron,3,gcash,520020791,
False,Buy Load > Broadband,2021-03-24 15:32:39,Nawawala...,lailandepadua,4,gcash,520020791,
False,nah,2020-07-10 07:12:06,i enjoyed using gcash before until the app crashes almost everyday.,Iz1988,2,gcash,520020791,
False,blaming users for tech issues,2020-11-22 10:49:17,please just make your maximum spending limit to 100 pesos per month since it’s broken anyway,gcash bobo,1,gcash,520020791,
False,Stressing,2020-11-01 09:22:53,im trying to update it but when its half finished it restarts,andy chenoweth,1,gcash,520020791,
False,Not reliable,2020-10-17 03:31:55,Worst app! Not reliable!! OTP doesn’t always work!!!,iamprns,1,gcash,520020791,
False,Crashing app,2020-09-11 11:19:00,App always crashes upon clicking “get fully verified”. PLEASE FIX YOUR APP ASAP!!,hrbsb00,1,gcash,520020791,
False,Bad customer support,2020-08-10 13:29:46,Napakahirap nyo po tlagang macontact kapag nagkaproblema! Nagfailed po payment ko online pero nadeduct pa rin sa account ko.. nakakatatlong send na ko ng tickets pero walang reply! Tumatawag din ako sa number nyo wala naman sumasagot.. please assist naman po..,krismsay04,1,gcash,520020791,
False,NASAAN ANG OTHER ID OPTIONS?,2020-06-03 20:17:51,"Hi, i cannot verify my gcash account kasi all i have is a student ID pero walang lumalabas na other ID option. Care to explain? Thanks.",ZenanM1,1,gcash,520020791,
False,Please notice.,2020-09-28 16:23:10,Can you add PRC ID on the verification?,Engr. MG,3,gcash,520020791,
False,Games,2020-11-25 05:29:08,Moana games doesnt even load! I paid for it rubbish game,geraldkidd,1,gcash,520020791,
False,Face ID,2020-09-23 10:33:11,Kailan nyo po i-implement ung faceid sa iphone? Thanks. Please respond,dainTsuki,4,gcash,520020791,
False,I cannot access my gcash account!,2020-09-27 06:47:52,I cannot simply log in on my MPIN. 😠,JENINE OLARVE,1,gcash,520020791,
False,What the hell Gcredit?,2021-05-22 17:20:41,I was about to pay the credits pero di naman ako makapasok nagloloading lagi. Then you send messages like kelangan ng bayaran. Paano though?????,ambotjiji,1,gcash,520020791,
False,Student id,2020-12-11 10:32:20,"Sana sa pag verify ng account magkaroon rin ng student id, wala kase akong ni isa na id na hinihingi sa pag verify, as a student I want to save my money para di ko magagastos at maraming pang dahilan, WISH KO LANG SANA SA PAG VERIFY MAGKAROON NADIN NG STUDENT ID.",itzmegeli29,2,gcash,520020791,
False,Nagloloko ung app using cash in western to gcash,2020-12-11 05:36:45,Nakakatakot umulit... I waited 5days just to get the money out of the gcash mas mabilis pa Kung dumiretso q sa western .. and Baka next time d pa mabalik ung pera .. nkkatakot isipin... lalo na Kung malaki,yamaxaki,1,gcash,520020791,
False,Not good,2020-08-24 08:57:10,I cant get fully verified using my school id,yujin0130,1,gcash,520020791,
False,Nice app.👍🏼,2021-04-26 00:50:27,Very useful.👌,altur72,5,gcash,520020791,
False,Automatically log out,2020-10-07 02:30:14,Hindi ko muna ginamit gcash ko dahil sa naglabasan na mga deduction keme ngayon gusto ko bumili ng load ganyan paulit ulit ano ba yan limited na nga ang verified id na pwede sa inyo ngayon another problem at sakit ng ulo naman.💔,Mj2sexy4u,1,gcash,520020791,
False,GREEDY DEVELOPERS/OWNERS,2020-09-29 10:29:30,"You mor*** disable any money transfer, so that on October 1st we will force to pay transfer fee. 👎",shficshajwk ndjsjs,1,gcash,520020791,
False,Awesome,2020-09-19 11:53:13,Very good app,pbajr,5,gcash,520020791,
False,Verification,2020-08-10 02:15:32,How come that my account cant be fully verified?,3p's,1,gcash,520020791,
False,Registration Issue,2020-06-21 07:38:37,I’m having trouble registering to GCASH. I cannot fill in the PIN to successfully register to GCASH.,dudz09,1,gcash,520020791,
False,app update jan 28 👎🏼👎🏼👎🏼,2021-01-28 15:45:58,new update made my account an unverified one 😭 what happened??? please fix this,#LRZJY,3,gcash,520020791,
False,Never use this app for bank transfer,2021-02-11 09:27:54,NEVER EVER USE THIS APP FOR BANK TRANSFER. Your money will take DAYS to be transferred.,Franix1092,1,gcash,520020791,
False,Send Money needs verified account,2020-10-29 18:13:39,So lame. Hahahahaha.,iamwalty,2,gcash,520020791,
False,Bring back Tin Id optiom,2020-08-31 13:27:38,Please bring back the tin id option 😊,Kakaibabe11,1,gcash,520020791,
False,I cant withdraw,2020-08-25 03:10:33,I cant withdraw via my saving.😒,hstaia,2,gcash,520020791,
False,Gcredit Scam,2020-07-27 15:57:10,They charge me additional of 400 for using gcredit even if I paid on timely basis.,Couldn't Enter the Nickname,1,gcash,520020791,
False,christmas time is near,2020-12-17 05:12:44,here for the aguinaldos lawl,lhnclmnl,5,gcash,520020791,
False,Poor customer support,2020-11-04 19:16:19,"Their CS is worst. All GCash concerns is not entrained in their Business Center, all should be E-Mailed.","(^,,_,,^)",1,gcash,520020791,
False,Biome-ughh,2020-09-09 03:46:44,The latest update introducing Biometrics does not work for my iPhone X.,NJChan85,1,gcash,520020791,
False,bring back the students id on verification,2020-08-06 11:29:14,can u please bring back the verification for students because of this pandemic gcash can help us a lot,adrian lang malaks,1,gcash,520020791,
False,can't verify using iphone,2020-06-28 15:35:49,when click the verify button the apps is automatic close. can't verify my apps.,rileym37,1,gcash,520020791,
False,Theres no g invest in my app,2021-04-27 05:12:40,Running in ip6,tinsqrd,3,gcash,520020791,
False,Online sabong,2021-05-18 13:35:54,Delay to cash out,bilisan nyo,1,gcash,520020791,
False,👎🏻,2020-11-04 22:21:56,Can’t send or transfer money 😠👎🏻,angge_24,1,gcash,520020791,
False,I cant download gcash,2020-09-01 17:47:02,App isn’t that good,arya starl.129,2,gcash,520020791,
False,It’s hard to verify account,2020-07-17 11:09:13,"Napaka hirap iverify, kelangan ko lang naman mag transfer, I mean what’s the rationale with that? Mas secured pa nga kung hindi nila gawin yon. Gcash is asking vital information.",bimbski,1,gcash,520020791,
False,Update,2020-12-11 10:05:39,The app doesn’t update. Lousy as usual,aktm99,1,gcash,520020791,
False,It’s good,2020-11-23 01:59:12,Did it’s job!,Macj4cked,4,gcash,520020791,
False,Wawents,2020-10-30 00:31:48,How many hours after update sya gagana? Tanginang service e.,_yunogasai,1,gcash,520020791,
False,Not convience,2020-09-25 04:18:03,Bring back the gaming credit!!,renai09,1,gcash,520020791,
False,Error,2020-09-09 04:56:25,Login error tru biometrics. Iphone 11,James daga,2,gcash,520020791,
False,"Not safe, scammer",2020-08-26 14:54:26,"I won't recommend this app anymore.
This app is a scammer.",LuiPogi,1,gcash,520020791,
False,Answer my call or email!,2020-08-11 23:13:31,Lage kayung naguupdate tapos kay my concern kami di nmn kayu sumasagot sabtawag even email! Its been 4 days na,Cj110718,1,gcash,520020791,
False,OTP PROBLEM,2020-08-02 11:10:00,The OTP is really slow or not coming at all. So inconvenient and inconsistent.,MabinMac,1,gcash,520020791,
False,Dont download GCASH,2020-07-28 05:54:09,Automatic na wawala pera ko wala man lang confirmation na binabawas nila. So i decided delete ko nalang kase laki ng pera na nawawala dahil walang confirmation. Bigla nalang may text ma ginamit na nila pera sa gcash. HASSLE! Delete nalang :),Noonebutu,1,gcash,520020791,
False,Can’t verify,2020-07-18 03:41:48,I cannot verify myself.,John_2486,1,gcash,520020791,
False,Review,2020-06-07 10:23:06,"This takes so long to be downloaded whats wrong with this, Di naman ganun ka bagal internet namin pero pati ba naman pag download nito globe mabagal din?? HAHA",Annebæ,2,gcash,520020791,
False,SUBMIT A TICKET,2021-03-08 09:15:13,I cant log in my gcash account in my iphone please fix gcash app,WarriyoXJC,1,gcash,520020791,
False,GREEDY,2020-09-25 23:13:22,This app starting to get greedy. Well its Globe. What do you expect,p01tonic,1,gcash,520020791,
False,2.58%,2020-07-03 09:30:47,Grabe na yan 2.58% charge fee taking advantage of the pandemic big NO NO! You’re not helping with the crisis. Patay gutom moves yan.,Florendz,1,gcash,520020791,
False,always need to update!,2020-09-29 09:59:48,why is it always need to update if i open this account?,Yi_o9,1,gcash,520020791,
False,FULLY VERIFICATION!!!,2020-07-18 13:06:35,Poor selection of options for ID's.,Kenneth990613,2,gcash,520020791,
False,DO NOT USE GLIFE,2021-04-11 20:10:15,Its buggy especially when you use gcash as payment. AND THE FACT THE CUSTOMER SERVICE DOES NOT REPLY AND UPDATE ABOUT REFUNDS IS STARTING TO GET ANNOYING.,Daboooooooooo,1,gcash,520020791,
False,Removal of postal id or prc id as suggested valid IDS 😭,2020-07-10 08:43:08,I hope you can put postal id or prc id as suggested valid ids,Raimiel06,1,gcash,520020791,
False,Payoneer Cash-in walang kwenta!,2021-01-07 09:43:40,"Since nung December 2020 lagi nalang “Oops our system is currently busy” maiintindihan ko pa nung December 2020, pero January 7 na parehong error parin.",Rodsburgh,1,gcash,520020791,
False,UNLINK GCASH ON APPLE SERVICES,2020-12-11 05:29:42,I already unlink my gcash account on my apple services yet it always reduced my money on my acc.,holymolly97,1,gcash,520020791,
False,i cant verified my gcash account,2020-06-22 14:07:01,please add student option so i can verified my account,baharula,2,gcash,520020791,
False,Cash out,2020-06-19 03:19:27,Walang kwenta mga cash out center niyo lahat sila offline cash in lang available ano puro kayo pasok mg pera pero du kami makalabas ng pera namin pati bank transfer niyo ayaw din punyeta!!!!!,therealdince,1,gcash,520020791,
False,Biometrics,2020-09-09 10:07:36,Face ID not working,Ytienne,3,gcash,520020791,
False,Scammer is always scammer and tha is globe telecom!,2021-05-28 13:04:29,Poor services as always,Sweetgabby05,1,gcash,520020791,
False,Online sabong,2021-05-18 02:15:15,Its not a good idea na magonline sabong marami nasagasaan kawawa ung mga agent na umaasa sa online sabong inagawan pa management should think about this 1 star!,Jhaileen0990,1,gcash,520020791,
False,worst app on the App Store,2020-12-07 11:33:16,"Full of bugs, no QA or whatsoever before deployment.",-Exe.-,1,gcash,520020791,
False,what is this error i am getting??,2020-10-09 18:05:52,i just updated the app and i now can’t log-in... why people????,yhal1223,1,gcash,520020791,
False,nice and useful app but...,2020-08-06 12:27:31,bugs bugs bugs,b y z a n c e,3,gcash,520020791,
False,Caanot input amount in Iphone x,2020-11-06 00:42:34,The keyboard does not appear on the app.,SelfieLord,1,gcash,520020791,
False,Error,2020-10-12 06:10:07,I cant log in...,elliam matthew,1,gcash,520020791,
False,problem with everything,2020-10-05 06:47:20,"send money, cash in (unionbank acct) -- all unavailable. one week na. pakiayos naman",052191,2,gcash,520020791,
False,Switching,2020-09-30 00:20:13,No for extra fees.,xARCADIAx,1,gcash,520020791,
False,they removed debit card cash in,2020-07-13 23:58:13,almost useless for me.,ジャエク,2,gcash,520020791,
False,Unable to enter mpin using ipad,2020-06-15 14:36:14,overlapping terms & condition and setting mpin,doreeees,1,gcash,520020791,
False,verification,2020-06-07 04:13:34,i cant verified my acc bc im still a minor i dont have any government id but the business i want to start is needed gcash so please accept the student id,nokaaah,1,gcash,520020791,
False,For verification,2020-06-05 03:17:56,wala pong other choices of ID for verification. Walang PRC ID or NBI man lang. Ang hirap makapagverify lalo kung wala sa choices. Hindi ako makacash out.,gwnsnav abshslskdvgsksjshshs,2,gcash,520020791,
False,Load,2021-02-09 12:15:58,Nagload ako ng 50 pesos nag text ang gcash na naload na tapos hindi pa pala na recieve yung load sa niloadan ko . Baka naman gcash ma fix niyo ang ganitong bagay .,hulyo..,2,gcash,520020791,
False,Gcash,2021-01-18 15:06:28,5 30,Kea dagloc,4,gcash,520020791,
False,Very poor communication,2020-09-22 05:21:13,I cannot register my account! THIS APP ISNT USEFUL AT ALL I SWEAR TO GOD. Too many scammer in this App,jet lee kee mpang,1,gcash,520020791,
False,crashed!!!!,2020-08-24 06:33:15,cannot fully verified my id because it crashes the app...,eskembergs,1,gcash,520020791,
False,Too much Deductions,2020-07-30 00:33:43,too much deductions,Chubbygail,1,gcash,520020791,
False,Can’t get verify,2020-06-03 16:14:15,Gcash why I can’t get verify using my Tin ID?,jackkkiieeee,1,gcash,520020791,
False,😞😞,2020-08-05 03:17:03,get verified is to slow,poklung,3,gcash,520020791,
False,Worst app..,2021-05-01 15:36:41,"Wala na talaga tung gcash unlike pass 2 years ago, useless na talaga Yun app ninyo, update pa more..",TheGameServerSucks,1,gcash,520020791,
False,Rebates,2020-12-15 23:48:08,I haven't received any rebates since November. Why????,futanman,1,gcash,520020791,
False,cannot link bpi,2020-07-11 06:52:00,i cannot link my bpi card to my gcash so that i can cash-in from my bpi accnt,ms.cess,2,gcash,520020791,
False,review,2020-07-23 10:00:30,no student id option. crashes.,nsajjzjwkdnsosk,1,gcash,520020791,
False,not satisfied,2020-06-05 09:11:13,please back the other options for id :((,a no ny mo us,1,gcash,520020791,
False,Basahin niyo to,2020-10-13 13:03:50,Puro kayo pa update. Ayaw niyo naman I-activate account ko Kahit baranggay clearance o student ID. Prinocess ko ron sa ticket ticket. I-consider niyo naman,PANSININ NIYO KO,2,gcash,520020791,
False,🤧,2020-06-11 11:59:40,I can’t verify my account!!!,leyanns,1,gcash,520020791,
False,availability,2020-11-05 14:31:17,make it available in hong kong ❤️,mr.antoeknee,4,gcash,520020791,
False,Additional Feature Needed,2020-12-12 02:49:19,Gcash should include SSS salary loan and emergency loan payments.,Falcon Sixteen,1,gcash,520020791,
False,Great app!!!,2020-08-19 08:18:27,This app is great,Selfish fish fish,5,gcash,520020791,
False,GSCORE,2020-08-11 11:26:23,My GSCORE is decreasing instead of earning points while I’m using GCASH regularly??????,Allan chu,1,gcash,520020791,
False,Hindi maka cash in through paypal,2021-04-03 09:12:10,"Walang customer service
Walang announcement 
Walang mabilis na action",itspowlah on IG,1,gcash,520020791,
False,THIEVES,2021-03-31 13:24:38,do not use this app. THEY ARE STEALING MONEY FROM PEOPLE. BIG AMOUNT. THEY STOLE MONEY FROM ME. Last march 24 ive got no update since then!!!!!!,bzZzzzxxzzzzzZzzz,1,gcash,520020791,
False,UGLY APP,2020-11-07 09:48:21,UGLLY APP!! Pahirapan mag verify. Walang nangyayari if I click any of the valid ids na pwede g i-submit para maka proceed. So my money is stuck in there!!!!,ge0717,1,gcash,520020791,
False,Beware!!! Gcash IS A BIG MODUS,2020-10-07 22:10:17,"Someone was
Able to get all my funds in my gcash acct.",Gelai1008,1,gcash,520020791,
False,GCash! All-in-One,2020-12-11 09:53:21,Maasahan !,Darlingl143,5,gcash,520020791,
False,Payable 1050 to use Gcash 😫,2021-04-24 15:02:05,"Before using Gcash , I have slready a payable of 1050 pesos?  That' s not the deal !!",wrrrsk wrrsk,1,gcash,520020791,
False,Please also include TIN ID on verifying the account.,2021-04-20 12:54:01,Please include,wiiwjcjekeifjdjkwkwowjx,1,gcash,520020791,
False,-0,2021-02-03 01:50:17,Disappointing.,Gm.asis,1,gcash,520020791,
False,Update then gcredit limit info requirement,2020-12-13 02:29:09,"Bkt nag update lng ako ndi ko na maopen, ang daming hinihinging info like gcredit limit.  Anu un?  Npaka complikado.",al vi n,1,gcash,520020791,
False,My ID is not on the list,2020-08-21 11:51:00,There’s no STUDENT ID in Gcash on IOS users,qksldn,1,gcash,520020791,
False,WON’T LET STUDENTS VERIFY,2020-08-04 18:55:51,Students should be allowed to be verified.,zyncospecter,1,gcash,520020791,
False,Gcash,2020-07-17 09:44:37,Why can’t I verify my gcash account?,Garciashane,1,gcash,520020791,
False,THIEF!!,2021-05-06 02:14:45,"I lost my P20,000 in gsave and now I can’t log in to my gcash!😭",Quinn Alecz,1,gcash,520020791,
False,Stupid,2020-08-30 08:29:11,It’s not working,unFair9182736,1,gcash,520020791,
False,Scam,2020-07-22 06:47:19,"To all users ng gcash...!! Grabe ilang beses na nangyri na nagkagnto
Dati d nrcve ng rcvr ung paymnt ang tagal bago nila ausin or d tlga nila aausin
Then mwwalan gcash acc mo...! Ganto cla kumuha pakonti konti sa dami ng user ganto kau magnaakaw????!!!!!! Tang ina gcash umaus kau ausin nyu to",debbie2308,1,gcash,520020791,
False,PLEASE INCREASE LIMIT,2021-01-25 12:02:33,HI CAN YOU PLEASE INCREASE THE LIMIT UP TO AT LEAST 250k FOR THOSE WHO ONLY HAS VERIFIED ACCOUNTS? AT LEAST HALF OF THE LIMIT WHEN YOU REACH THE w/ LINKED BANK ACCOUNT? 🥺,ACBGLPO,3,gcash,520020791,
False,NO OTP RECEIVED,2020-10-21 02:18:44,It’s been more than 24 hours!,Tam Yamson Briaga,1,gcash,520020791,
False,USELESS CUSTOMER SERVICE,2021-01-21 10:02:42,cs wont assist me in refunding the payment they accepted for a non-existent account,Tetortsz,1,gcash,520020791,
False,UNACCESSIBLE!!😡,2020-08-29 12:10:30,Can’t access my account! Laging may error!,airen Lee!,1,gcash,520020791,
False,Hurry up,2021-04-27 00:38:38,"My GCash nag eexit ,d cia nag oopen pls help",liamkulit,3,gcash,520020791,
False,unclear photo id,2021-05-31 13:51:38,fix it. i dont know what you expect from me. a bloody dslr camera?,khrbciowma,1,gcash,520020791,
False,not so convenient,2021-05-28 07:45:46,"Lagi nalang error, submit a ticket, kung kailan need saka nagiging ganon. Then napakabagal magload ng gcash lately di ko alam kung anong problema",vjjsjjrjdjw,1,gcash,520020791,
False,no chat support,2021-04-30 01:46:56,difficult to get help support in a live chat,lhan78,1,gcash,520020791,
False,Cash in on paypal,2021-01-02 09:12:34,I cant cash in paypal to gcash,serafinacuizon,3,gcash,520020791,
False,lagi nalang may problema yung gcash,2021-01-09 08:42:48,"nagdededuct kayo ng money sa account ko pero di naman nag go go thru sa senendan o payment like pldt. tagal nyo pa irefund. useless 2882 nyo pati cs nyo. automated sa
page nyo tapos ngayon may bayad na na 15 pag nagsend gcash to bank? papanget ng papanget service nyo",usuckwirex,1,gcash,520020791,
False,GCASH APP NEEDS SERIOUS UPDATE,2020-10-14 06:53:38,"I heard a lot of bad reviews for this app. Made me want to rethink my decision to use it. I plan to use GCash to pay for my App Store since Apple is no longer downloading any Free apps without credit info. I was just at the registration page when I already encountered something ridiculous. You see, my name has a hyphen, like “John–Henry”. Of course under the given name field I’ll type “John–Henry”. But the developer decided the special character is illegal. So I’m forced to type “John Henry” which is not the same. It infuriates me when software does this to me. It infuriates me more when the developer should know better. This was probably a foretaste of the disappointment yet to come. Fortunately for Globe it wasn’t all bad. I got the app working for now but not after a big headache. 

The Cash In from Banks instructions need some updating. I tried to follow the instructions step by step. Eventually I experimented and found my way through. At least fix the East-West bank cash in instructions because that’s what I used so far. 

During Verification, the Link that’s supposed to lead to Terms and Conditions led me to the GCash Welcome/Advertisement Page. I suppose it was leading me to the little words at the bottom of page. 

I cannot adjust my Profile name without having to go through the tedious 3–Step Verification process. What gives?

The Send Money “Optional Message” malfunctions when using non–alphanumeric characters like comma (,) and apostrophe (‘). 

.",The Real Templar,2,gcash,520020791,
False,Iphone 5 not working for New update,2020-09-20 00:20:07,Di na ako Nakaka Open,magallanes Jeff,1,gcash,520020791,
False,crshing,2020-06-03 01:29:04,I give 1 star to gcash kasi hindi ako makapag fully verified nag cacrash ang application nila kapag nag fufully verify ako  ano pa silbi ng pa gcash app nyo if ayaw nyo naman magpa verify,Chuchiya,1,gcash,520020791,
False,Paypal cash in,2021-05-16 23:13:35,Palaging unable to prcess your paypal cash in at this moment. Ilang ulit ko na din na nagupdate ng app at relink ng paypal account ko. Wla parin. Ano ba palagi na lang ganito.,faithmyrel,1,gcash,520020791,
False,slow,2020-12-18 11:22:58,so slow on my iphone xr,RecodeX,1,gcash,520020791,
False,CANNOT EVEN VERIFY MY ACCOUNT,2020-11-23 05:05:59,"Won't proceed every time I click Verify now. PLUS, USELESS CUSTOMER SERVICE. 0/5",ca1oy,1,gcash,520020791,
False,Not recommended,2020-11-09 05:43:56,Palpak mga services. Puro reversal transaction.,hohogage,2,gcash,520020791,
False,ayaw mag open ng apps,2020-08-27 06:36:50,hindi ba nag oopen ung gcash apps pag data? LOA971 lumalabas... pero ok nman ung data connection ko and updated nman. ..,ka termyo,1,gcash,520020791,
False,Didn’t accept TIN ID,2020-07-15 09:32:10,There’s no TIN ID on the choices of choosing ids to get verified.,Duh17,1,gcash,520020791,
False,Friend referral,2021-05-19 12:45:09,I didn’t recieve fees after reffering a friend.,neveoJ,1,gcash,520020791,
False,lod to scratch,2021-01-05 06:19:43,all linked for load scratch promo not working,habehuzuaiw,1,gcash,520020791,
False,with 2% cashin,2020-06-07 04:58:21,i used gcash a lot... sadly they already implementing 2% add on cash in outlet,vhiikhii,2,gcash,520020791,
False,Student ID verification,2020-07-25 05:58:01,Halos 1 month kona tinatry mag verify gamit ang student ID pero wala sa options hanggang ngayon di pa nakaka verify.....plsss paki ayos namn app nyo..,naiansnss,1,gcash,520020791,
False,Basura basura,2020-07-05 09:37:14,Trash. Napaka basura ng app nyo. Majority ng users nyo student pero di makapag fully verify ng acc using students ID. Napaka basura niyo. Di niyo iniisip users nyo. Basura.,gcash basura,1,gcash,520020791,
False,Poor Camera For Verification Issue,2021-05-12 01:14:14,Kasalanan ba namin wala budget sa pambili ng mamahalin Phone,Pipyok,1,gcash,520020791,
False,"The best in PH, because it’s the only thing we can settle for here",2021-04-24 01:39:51,"The app boasts of its growth and tech expertise in PH, and tbh, it’s true that it is advanced. But looking at the tech landscape, GCash monopolizes the market being the only full-stack virtual wallet there. Obviously it would land the top spot. I would receive top honors too if I were the only person in the class, even if my scores were abysmal.

Pit it against international apps and it falls hella short.

Going through the experience of the app alone shows that it lacks proper UX and upkeep to provide a seamless journey per action. Wala lang talaga ibang option ang Pinoy, so they settle for this award-winning-but-really-mediocre app.

I hope GCash has a faster tat to iron out the persistent bugs, the constant crashes, the clunkiness of the overall feel, and many more. Better live up to your awards & recognitions. Numbers from 2020 speak of necessity and not the prowess of the app.

Bugs, to name a few:
1. Persistent errors in GForest - either energy not reflecting or energy stolen causes app to crash.
2. Enrolled cash in banks do not reflect from time to time. One ends up having to repeatedly enroll the same bank whenever it disappears.
3. Enrolling bills is a frikin pain. Why can’t I enroll my CCs so I can regularly pay? I can only enroll Meralco and Globe. Why?!
4. Have you ever heard of consistent autofill? In paying bills, it’s a hit or miss. Sometimes autofill works, but 80% of the time it doesn’t. If you wanna instill habit, then make it easier for the consumer.
5. Cash in amount. I’ve used GCash since 2019. Obviously I am entitled to the max daily cash in. How come lately I’m unable to do this?

Looking forward to bug fixes + the app to actually live up to its claim as a functional virtual wallet. Alipay has robust tech resources to help support your enhancements. Best to maximize it.",Halmeoni51,2,gcash,520020791,
False,Bring back buy load regular!!,2021-03-09 04:54:21,PLEASE BRING BACK THE REGULAR LOAD!,EDiWOW0310,1,gcash,520020791,
False,Verification,2020-10-11 16:23:50,"Provided na lahat ng requirements ibinigay na lahat kasi personal na details para lang ma verify ayaw parin. Nakakapagod na. Paulit ulit, trash GCASH. Uninstall this app.",iHateGcash1000user,1,gcash,520020791,
